{
  "schema": 1,
  "name": "tkinter",
  "owner": "MonoEven",
  "version": "0.95.0",
  "revision": 1,
  "published": "2026-06-03T00:00:00+00:00",
  "entry": "src/stdlib/examples/tkinter.ahk",
  "engines": {
    "autohotkey": ">=2.0"
  },
  "platforms": [
    "any"
  ],
  "capabilities": [],
  "dependencies": {},
  "source": {
    "kind": "git",
    "repository": "MonoEven/stdlib-ahk",
    "commit": "abbd522c972afdfbeec6f30e2e9d545887a6149e",
    "url": "https://www.autohotkey.com/boards/viewtopic.php?t=140771&p=619179#p619179"
  },
  "artifacts": {
    "any": {
      "sha256": "1e540279f5e20965bdb56f5cd7f47980881981713054549f8f29ffeef5ac6aa7",
      "size": 60746,
      "sources": [
        "https://github.com/keysharp-org/Packages/releases/download/pkg/MonoEven/tkinter/0.95.0-r1/tkinter-0.95.0-r1-any.kspkg"
      ]
    }
  }
}
