{
  "schema": 1,
  "name": "GpGFX",
  "owner": "bceenaeiklmr",
  "version": "0.2.0",
  "revision": 1,
  "published": "2025-04-13T00:00:00+00:00",
  "entry": "src/GpGFX_standalone.ahk",
  "engines": {
    "autohotkey": ">=2.0"
  },
  "platforms": [
    "any"
  ],
  "capabilities": [],
  "dependencies": {},
  "source": {
    "kind": "git",
    "repository": "bceenaeiklmr/GpGFX",
    "commit": "1fa877294d7d7152ff78d3f79c79403cf629f287",
    "url": "https://github.com/bceenaeiklmr/GpGFX"
  },
  "artifacts": {
    "any": {
      "sha256": "d97ae43d11cbf84b7ac9f66ad14be9a673525df1ccf9cb123b2dc66f9fd2bb03",
      "size": 37680,
      "sources": [
        "https://github.com/keysharp-org/Packages/releases/download/pkg/bceenaeiklmr/GpGFX/0.2.0-r1/GpGFX-0.2.0-r1-any.kspkg"
      ]
    }
  }
}
