{
  "schema": 1,
  "name": "inheritance",
  "owner": "cebolla",
  "version": "1.12.0",
  "revision": 1,
  "published": "2026-08-28T00:00:00+00:00",
  "entry": "src/inheritance/Inheritance.ahk",
  "engines": {
    "autohotkey": ">=2.0"
  },
  "platforms": [
    "any"
  ],
  "capabilities": [],
  "dependencies": {},
  "source": {
    "kind": "git",
    "repository": "Nich-Cebolla/AutoHotkey-LibV2",
    "commit": "85d6d02156b055712fe8a9b4c5cbc9eceb2180a7",
    "path": "v1.12.0"
  },
  "artifacts": {
    "any": {
      "sha256": "74d0b38646f444fc487c50e04e21785f4515a91e3f6574bdc58b308a20515e60",
      "size": 29582,
      "sources": [
        "https://github.com/keysharp-org/Packages/releases/download/pkg/cebolla/inheritance/1.12.0-r1/inheritance-1.12.0-r1-any.kspkg"
      ]
    }
  }
}
