{
  "schema": 1,
  "name": "HashMap",
  "owner": "G33kDude",
  "version": "1.0.0",
  "revision": 1,
  "published": "2026-08-28T00:00:00+00:00",
  "entry": "src/Dist/HashMap.ahk",
  "engines": {
    "autohotkey": ">=2.0"
  },
  "platforms": [
    "any"
  ],
  "capabilities": [],
  "dependencies": {},
  "source": {
    "kind": "git",
    "repository": "G33kDude/HashMap.ahk",
    "commit": "a4469d81e114ed1512a31b89df84bd5818774ee4",
    "path": "1.0.0",
    "url": "https://github.com/G33kDude/HashMap.ahk"
  },
  "artifacts": {
    "any": {
      "sha256": "8bd32f7695096a384864bf92ce9a345b5c519a8555fda3cbdd8d0b9dcae0c07b",
      "size": 16049,
      "sources": [
        "https://github.com/keysharp-org/Packages/releases/download/pkg/G33kDude/HashMap/1.0.0-r1/HashMap-1.0.0-r1-any.kspkg"
      ]
    }
  }
}
