{
  "schema": 1,
  "name": "shinsimagescanclass",
  "owner": "spawnova",
  "version": "0.7.0",
  "revision": 1,
  "published": "2024-05-19T00:00:00+00:00",
  "entry": "src/AHK V2/ShinsImageScanClass.ahk",
  "engines": {
    "autohotkey": ">=2.0"
  },
  "platforms": [
    "any"
  ],
  "capabilities": [],
  "dependencies": {},
  "source": {
    "kind": "git",
    "repository": "Spawnova/ShinsImageScanClass",
    "commit": "b1506084eb839e0918c46aae5b92fac6c5bb984c"
  },
  "artifacts": {
    "any": {
      "sha256": "3403dbf32e453deb46d2bfebe6914fdf00d01e80bd922beeaf5c647a2184347c",
      "size": 37606,
      "sources": [
        "https://github.com/keysharp-org/Packages/releases/download/pkg/spawnova/shinsimagescanclass/0.7.0-r1/shinsimagescanclass-0.7.0-r1-any.kspkg"
      ]
    }
  }
}
