{
  "schema": 1,
  "name": "Lua",
  "owner": "Delta-Pythagorean",
  "version": "0.1.0",
  "revision": 1,
  "published": "2024-11-01T00:00:00+00:00",
  "entry": "src/v2/Delta Pythagorean/Lua.ahk",
  "engines": {
    "autohotkey": ">=2.0"
  },
  "platforms": [
    "any"
  ],
  "capabilities": [],
  "dependencies": {},
  "source": {
    "kind": "scripthub",
    "repository": "ahkscript/ScriptHub",
    "commit": "136ca4bc5a7ec8a4bdfcbacebb8bc195658d1e93",
    "url": "https://www.autohotkey.com/boards/viewtopic.php?t=122655"
  },
  "artifacts": {
    "any": {
      "sha256": "75732267c3eb8d6fe2029f6426a3b56b3365586ec0dd4475b6ee1058d9a85743",
      "size": 4325,
      "sources": [
        "https://github.com/keysharp-org/Packages/releases/download/pkg/Delta-Pythagorean/Lua/0.1.0-r1/Lua-0.1.0-r1-any.kspkg"
      ]
    }
  }
}
