{
  "schema": 1,
  "name": "tanuki",
  "owner": "0w0demonic",
  "version": "0.25.0",
  "revision": 1,
  "published": "2025-09-01T00:00:00+00:00",
  "entry": "src/tanuki.ahk",
  "engines": {
    "autohotkey": ">=2.0"
  },
  "platforms": [
    "any"
  ],
  "capabilities": [],
  "dependencies": {
    "0w0demonic/aquahotkey": "*",
    "holy-tao/ahkwin32projection": "*"
  },
  "source": {
    "kind": "git",
    "repository": "0w0Demonic/Tanuki",
    "commit": "4dc02658f6b62b81fbbf797e26fdf24467ab6799"
  },
  "artifacts": {
    "any": {
      "sha256": "6b13f348018d30b66f346c27e7a069b61925c6ee71bc3ac4650fa61030bfdfc1",
      "size": 7410,
      "sources": [
        "https://github.com/keysharp-org/Packages/releases/download/pkg/0w0demonic/tanuki/0.25.0-r1/tanuki-0.25.0-r1-any.kspkg"
      ]
    }
  }
}
