{
  "schema": 1,
  "name": "GetFilePEHeader",
  "owner": "jNizM",
  "version": "0.2.0",
  "revision": 1,
  "published": "2021-10-13T00:00:00+00:00",
  "entry": "src/src/FileObject/GetFilePEHeader.ahk",
  "engines": {
    "autohotkey": ">=2.0"
  },
  "platforms": [
    "any"
  ],
  "capabilities": [],
  "dependencies": {},
  "setup": {
    "message": "Upstream defines install-time commands (postdownload) that this registry does not run. If this package needs a driver, a tool, or a setup step, follow its own instructions."
  },
  "source": {
    "kind": "git",
    "repository": "jNizM/ahk-scripts-v2",
    "commit": "07459394ab07c4832d53cfc098c92b8afe45ff7d"
  },
  "artifacts": {
    "any": {
      "sha256": "079c5c32140825ae6d4adeb7e0fe7e86040c3cdf6be17bbb665e043ddf52ce3c",
      "size": 1025,
      "sources": [
        "https://github.com/keysharp-org/Packages/releases/download/pkg/jNizM/GetFilePEHeader/0.2.0-r1/GetFilePEHeader-0.2.0-r1-any.kspkg"
      ]
    }
  }
}
