{
  "schema": 1,
  "name": "child_process",
  "owner": "thqby",
  "version": "0.12.0",
  "revision": 1,
  "published": "2025-11-12T00:00:00+00:00",
  "entry": "src/child_process.ahk",
  "engines": {
    "autohotkey": ">=2.0"
  },
  "platforms": [
    "any"
  ],
  "capabilities": [],
  "dependencies": {},
  "source": {
    "kind": "git",
    "repository": "thqby/ahk2_lib",
    "commit": "bc0e40dfbd295f9c25c159666a86d1fe604766cf"
  },
  "artifacts": {
    "any": {
      "sha256": "4f3dd7a8ce76025a0281e654ec14c999799bd9c12b177aec3fe24eabcad7239f",
      "size": 4208,
      "sources": [
        "https://github.com/keysharp-org/Packages/releases/download/pkg/thqby/child_process/0.12.0-r1/child_process-0.12.0-r1-any.kspkg"
      ]
    }
  }
}
