{
  "schema": 1,
  "name": "FindText",
  "owner": "feiyue",
  "version": "0.7.0",
  "revision": 1,
  "published": "2024-10-15T00:00:00+00:00",
  "entry": "src/v2/feiyue/FindText.ahk",
  "engines": {
    "autohotkey": ">=2.0"
  },
  "platforms": [
    "any"
  ],
  "capabilities": [],
  "dependencies": {},
  "source": {
    "kind": "scripthub",
    "repository": "ahkscript/ScriptHub",
    "commit": "3ff232fbdfa382ea9a5570cbde86b394d0c98fa6",
    "url": "https://www.autohotkey.com/boards/viewtopic.php?f=83&t=116471"
  },
  "artifacts": {
    "any": {
      "sha256": "76bce3e79213564a4b203866d5538f1b45661cfbd2a0fb930b1eed2b267ea5e1",
      "size": 42281,
      "sources": [
        "https://github.com/keysharp-org/Packages/releases/download/pkg/feiyue/FindText/0.7.0-r1/FindText-0.7.0-r1-any.kspkg"
      ]
    }
  }
}
