{
  "schema": 1,
  "name": "RegisterWaitCallback",
  "owner": "lexikos",
  "version": "0.3.0",
  "revision": 1,
  "published": "2024-09-30T00:00:00+00:00",
  "entry": "src/v2/lexikos/RegisterWaitCallback.ahk",
  "engines": {
    "autohotkey": ">=2.0"
  },
  "platforms": [
    "any"
  ],
  "capabilities": [],
  "dependencies": {},
  "source": {
    "kind": "scripthub",
    "repository": "ahkscript/ScriptHub",
    "commit": "fd3011975aaeb45103bf78d555700b136a25da96",
    "url": "https://www.autohotkey.com/boards/viewtopic.php?f=83&t=110691"
  },
  "artifacts": {
    "any": {
      "sha256": "5f3a10e0bf9362fdab759401427ee118b667352b101ffc150eaaec26cedef8b5",
      "size": 2054,
      "sources": [
        "https://github.com/keysharp-org/Packages/releases/download/pkg/lexikos/RegisterWaitCallback/0.3.0-r1/RegisterWaitCallback-0.3.0-r1-any.kspkg"
      ]
    }
  }
}
