{
  "schema": 1,
  "name": "UIA",
  "owner": "Descolada",
  "version": "1.1.3",
  "revision": 1,
  "published": "2026-08-28T00:00:00+00:00",
  "entry": "src/Lib/UIA.ahk",
  "engines": {
    "autohotkey": ">=2.0"
  },
  "platforms": [
    "any"
  ],
  "capabilities": [],
  "dependencies": {},
  "source": {
    "kind": "git",
    "repository": "Descolada/UIA-v2",
    "commit": "9f5a181c5d56d0cbc04e0a709fb875ab0059f762",
    "path": "v1.1.3",
    "url": "https://github.com/Descolada/UIA-v2"
  },
  "artifacts": {
    "any": {
      "sha256": "5fad03e7d26680f88bda4565f11522cdc45d69e743e07a27162ea147eea8fbd9",
      "size": 84704,
      "sources": [
        "https://github.com/keysharp-org/Packages/releases/download/pkg/Descolada/UIA/1.1.3-r1/UIA-1.1.3-r1-any.kspkg"
      ]
    }
  }
}
