{
  "schema": 1,
  "name": "Cursor",
  "owner": "Komrad-Toast",
  "version": "0.1.0",
  "revision": 1,
  "published": "2025-02-10T00:00:00+00:00",
  "entry": "src/v2/Komrad Toast/Cursor.ahk",
  "engines": {
    "autohotkey": ">=2.0"
  },
  "platforms": [
    "any"
  ],
  "capabilities": [],
  "dependencies": {},
  "source": {
    "kind": "scripthub",
    "repository": "ahkscript/ScriptHub",
    "commit": "669b77563914399f32ca32f16c56954062a17cbc",
    "url": "https://www.autohotkey.com/boards/viewtopic.php?f=83&t=135044"
  },
  "artifacts": {
    "any": {
      "sha256": "e8ddeddb4fd618b5023d6b80053b88c3b3f0208848274fc33e4e23e149aae88e",
      "size": 5851,
      "sources": [
        "https://github.com/keysharp-org/Packages/releases/download/pkg/Komrad-Toast/Cursor/0.1.0-r1/Cursor-0.1.0-r1-any.kspkg"
      ]
    }
  }
}
